223,Natural Language Processing (NLP),223.pdf,Text Encoding and Embedding Techniques,NLP Text Representation Methods,Word Embeddings in Natural Language Processing,Sentiment analysis in social media,Chatbot development,Text classification for content moderation,"A NLP Project focusing on representing text data using methods like word embeddings for AI applications. It utilizes Python with toolkits such as Pandas, NumPy, Scikit-learn, Gensim, NLTK, and Sentence Transformers. The techniques are applicable to various use cases, including sentiment analysis in social media, chatbot development, text classification for content moderation, and vectorizing text for AI models.",,,223,"Data Science , Natural Language Processing (NLP)",Intermediate,Python,"Pandas, NumPy, Matplotlib, Seaborn, Scikit-learn, Gensim, NLTK, Sentence Transformers",8 hours,"Text Processing, Embeddings, NLP, Clustering, Classification, Visualization",,,,,,223.jpg,223.mp4,223.md,223.pdf,,,https://notebooklm.google.com/notebook/79e95d05-4ad0-4867-8b6b-073b16d30fc9
224,Deep Learning,224.pdf,Mixed Curvature Variational Autoencoders,VAEs on Riemannian Manifolds,Advanced Generative Models for Data,Generating synthetic data for research,Anomaly detection in complex datasets,Dimensionality reduction in high-dimensional data,"Non-Euclidean Autoencoders focusing on VAEs on Riemannian Manifolds to generate synthetic data, perform anomaly detection, and achieve dimensionality reduction in complex and high-dimensional datasets.",,,224,"Machine Learning , Generative AI",Advanced,Python,"PyTorch, Geoopt, NumPy, SciPy, Matplotlib",10 hours,"PyTorch, GenAI, Matplotlib",,,,,,224.jpg,224.mp4,224.md,224.pdf,,,https://notebooklm.google.com/notebook/27d9edcf-ba44-4ccc-9157-d69b51dbd3c5
225,Generative AI,225.pdf,GenBiz AI: Zero-to-Startup AI Co-Founder,AI-Assisted Startup Planning Tool,Generative AI for Business Ideas,Rapid business plan creation,Market research automation,Startup idea validation,"Zero-to-Startup AI Co-Founder as a tool using Generative AI for business ideas, enabling rapid business plan creation, market research automation, and startup idea validation.",,,225,"Data Science , AI",Intermediate,Python,"LangChain, OpenAI, FAISS, Sentence Transformers, Pandas, NumPy",8 hours,"AI, Entrepreneurship, Startup, Generative AI, Business Planning, Market Research",,,,,,225.jpg,225.mp4,225.md,225.pdf,,,https://notebooklm.google.com/notebook/0fb60c82-4823-4663-800b-cb580eafc365
226,Data Analytics,226.pdf,Sickle Cell Morphology Classification,Image-Based Blood Cell Analysis,Computer Vision for Medical Imaging,Automated blood disease diagnosis,Medical imaging assistance,Research in hematology,"A machine learning project for classifying cell shapes to aid in the automated diagnosis of blood diseases, leveraging computer vision techniques for image-based blood cell analysis.",,,226,"Data Science, Biomedical",Intermediate,"R, ImageJ Macro","ImageJ, readxl, e1071, clValid, cluster, xlsx",5 hours,"Image processing, clustering, classification, sickle cell disease, machine learning",,,,,,226.jpg,226.mp4,226.md,226.pdf,,,https://notebooklm.google.com/notebook/e55d017f-fe11-4d8c-97e3-81f89170b473
227,Machine Learning,227.pdf,Simulating Natural Selection and Decision-Making in Game Theory,Evolutionary Algorithms in Strategic Games,Game Theory Simulations with Evolution,Economic policy modeling,Biological evolution studies,AI strategy optimization,"Simulating Natural Selection and Decision-Making in Game Theory, focusing on Adaptive Decision-Making Models.",,,227,"Computer Science , Data Science",Intermediate,Python,"NumPy, Matplotlib, NashPy",8 hours,"Data Visualisation, Matplotlib, Python",,,,,,227.jpg,227.mp4,227.md,227.pdf,,,https://notebooklm.google.com/notebook/37905eaf-5614-4d12-a286-47592d12431c
228,Machine Learning,228.pdf,AI-Powered Sudoku Solver,Computer Vision Sudoku Recognition,ML-Based Puzzle Solving,Educational tools for logic puzzles,Automated game solving apps,Vision-based problem recognition,"Image-to-Solution AI for Suduko using Computer Vision, Machine Learning",,,228,"Computer Vision , Machine Learning",Intermediate,Python,"OpenCV, TensorFlow, NumPy, imutils, scikit-image, py-sudoku",5 hours,"Sudoku, OCR (Optical Character Recognition), CNN (Convolutional Neural Network), Computer Vision, Machine Learning",,,,,,228.jpg,228.mp4,228.md,228.pdf,,,https://notebooklm.google.com/notebook/0e27be78-4748-40bd-99ee-1496d93ac65d
229,Deep Learning,229.pdf,MNIST Digit Classification with Neural Networks,CNN for Handwritten Digit Recognition,Deep Learning Image Classification,Automated check reading in banking,Postal code recognition,Digitizing handwritten documents,"Classifying handwritten digits using a Convolutional Neural Network (CNN) as part of a deep learning image classification task, with applications such as optical character recognition (OCR) for digitizing documents, recognizing postal codes, and automated check reading in banking.",,,229,"Machine Learning , Computer Vision",Intermediate,Python,"PyTorch, Torchvision, NumPy, Matplotlib",5 hours,"Neural Networks, CNN, Image Classification, MNIST, Deep Learning",,,,,,229.jpg,229.mp4,229.md,229.pdf,,,https://notebooklm.google.com/notebook/0f863db3-2fba-42a9-bb3d-0e002f008efd
230,Natural Language Processing (NLP),230.pdf,Implementing Word Embeddings from Scratch,Building Text Vectors Manually,Prediction-Based Embeddings (Word2Vec),"Solving word analogies (e.g., king - man + woman  queen)", Finding similar words based on semantic relationships,"Text similarity, sentiment analysis","A NLP project focusing on the fundamental concepts of converting text into vectors for AI applications. It explores methods like Prediction-Based Embeddings (Word2Vec) and can be used for solving word analogies, finding similar words based on semantic relationships, text similarity, and sentiment analysis.",,,230,Data Science,Intermediate,Python,"NumPy, Matplotlib, NLTK, Scikit-learn, Gensim",8 hours,"NLP, word embeddings, word2vec, co-occurrence matrix, SVD, GloVe",,,,,,230.jpg,230.mp4,230.md,230.pdf,,,
231,Machine Learning,231.pdf,Linear Regression to Multi-Armed Bandits,RL Fundamentals with Bandit Problems,Exploring Decision-Making Algorithms,Recommendation systems,Autonomous vehicle control,Game AI development,"A Machine Learning project exploring the fundamentals of Reinforcement Learning (RL) with Bandit Problems, transitioning from Linear Regression and Gradient Descent concepts to Multi-Armed Bandits. Delves into the crucial Exploration-Exploitation Tradeoff and is relevant for applications in recommendation systems, autonomous vehicle control, and game AI development.",,,231,"Data Science , Machine Learning",Intermediate,Python,"NumPy, Pandas, Matplotlib",8 hours,"Machine Learning, Reinforcement Learning, Linear Regression, Gradient Descent, Multi-Armed Bandits, Exploration-Exploitation Tradeoff",,,,,,231.jpg,231.mp4,231.md,231.pdf,,,https://notebooklm.google.com/notebook/1fb1b818-5640-477c-8c7b-7f6945930333
232,App Development,232.pdf,React Native Post Feed & User Profile App,Mobile Social Media App with React Native,Cross-Platform User Interface Design,Social networking platforms,Content sharing apps,User engagement in mobile apps,"A React Native Post Feed & User Profile App, which functions as a mobile social media and content-sharing platform focusing on cross-platform user interface design and user engagement in mobile apps.",,,232,Mobile App Development,Beginner,JavaScript,"React Native, Expo, React Navigation, React Native Paper",5 hours,"React Native, Expo, Mobile App, API Integration, Navigation",,,,,,232.jpg,232.mp4,232.md,232.pdf,,,https://notebooklm.google.com/notebook/84efe4af-68ce-4650-be7f-a4aaf9d4a6c8
233,Software Development,233.pdf,OCR API with Bounding Boxes,Text Extraction from Images API,Computer Vision for Document Scanning,Document digitization services,Automated data entry,Accessibility tools for visually impaired,"An OCR API that provides Optical Character Recognition (OCR) with location detection, commonly referred to as bounding boxes. It is designed for applications like document digitization services, automated data entry, and accessibility tools for the visually impaired. ",,,233,"Web Development , Computer Vision",Intermediate,JavaScript (Node.js),"Express, Tesseract.js, Multer, JSDOM, Body-parser, Chai, Chai-HTTP, Mocha",4 hours,"OCR, API, Node.js, Tesseract, Image Processing, Bounding Boxes",,,,,,233.jpg,233.mp4,233.md,233.pdf,,,https://notebooklm.google.com/notebook/01096217-e460-44ae-91df-0ab6b971736f
234,Web Development,234.pdf,AI-Powered Portfolio Generator,LLM-Based Web Portfolio Creation,AI Code Generation for Personal Sites,Quick portfolio building for freelancers,Prototyping web designs,Educational coding assistants,"An AI-Powered Portfolio Generator that functions as an Automated Web Development Tool. This tool enables quick portfolio building for freelancers, assists in prototyping web designs, and serves as an educational coding assistant.",,,234,"Full-Stack, Web Development,  AI ",Advanced,JavaScript (Node.js),"Express.js, React, MongoDB, Passport.js, Anthropic Claude API, Sandpack",25 hours,"Web Development, Node.js, AI, NoSQL, mongoDB",,,,,,234.jpg,234.mp4,234.md,234.pdf,,,https://notebooklm.google.com/notebook/baed77a1-10d5-40f0-a87c-3109f9bd4227
235,Misc - Data Sci,235.pdf,Dynamic Pricing for Urban Parking Lots,Real-Time Parking Price Optimization,Demand-Based Parking Fees,Urban traffic management,Revenue optimization for cities,Convenient parking for drivers,"A Smart Parking Management System that implements dynamic pricing models, such as a real-time demand-based approach, for urban parking lots to optimize resource usage, reduce congestion, improve driver convenience, and enhance revenue optimization for cities. The system often uses real-time data processing and interactive visualizations.",,,235,Data Science,Intermediate,Python,"Pandas, NumPy, Bokeh",4 hours,"Dynamic Pricing, Parking Analytics, Data Visualization, Real-time Systems",,,,,,235.jpg,235.mp4,235.md,235.pdf,,,https://notebooklm.google.com/notebook/5f25faf7-abb3-4bcf-9f82-79567058748a
236,Machine Learning,236.pdf,Medical Book RAG Chatbot with AgenticAI,RAG-Based Medical Q&A System,AI Chatbot for Health Information,Patient education tools,Medical research assistance,Virtual health advisors,Retrieval-Augmented Medical Assistant,,,236,"Data Science , Artificial Intelligence",Intermediate,Python,"Streamlit, LangChain, OpenAI API, ChromaDB, pdfplumber, PyMuPDF, Tesseract OCR, Pandas, PIL",5 hours,"OCR, API, Python, Tesseract, Streamlit, LangChain, AI",,,,,,236.jpg,236.mp4,236.md,236.pdf,,,https://notebooklm.google.com/notebook/9cb58221-a92f-46e8-abe5-428b88a2e817
237,Data Analytics,237.pdf,Revenue Leakage Analysis in Hospitality,Data Analysis for Hotel Revenue Loss,Python-Based Hospitality Insights,Hotel revenue management,Tourism industry optimization,Business intelligence in hospitality,"Revenue Leakage Analysis in Hospitality, focuses on identifying the impact of booking cancellations, supporting use cases like hotel revenue management, tourism industry optimization, and business intelligence in hospitality.",,,237,Data Science,Intermediate,Python,"Pandas, Seaborn, Matplotlib",8 hours,"Revenue Leakage, Hospitality Analytics, Data Visualization, Business Intelligence",,,,,,237.jpg,237.mp4,237.md,237.pdf,,,https://notebooklm.google.com/notebook/8cf642f1-485b-40f6-b4ae-dd8e80dd2bc2
238,Misc - Data Sci,238.pdf,Urban Retail Inventory Forecasting System,SQL-Based Stock Prediction,Database-Driven Inventory Management,Supply chain optimization,Retail inventory control,Demand planning in stores,"Urban Retail Inventory Forecasting System focused on leveraging data science and database management to optimize the supply chain, control retail inventory, and facilitate demand planning in stores through forecasting retail demand. Key technologies include SQL and MySQL.",,,238,"Data Science , Database Management",Intermediate,SQL,MySQL,5 hours,"SQL, Database Design, Inventory Management, Data Analysis, Retail Analytics",,,,,,238.jpg,238.mp4,238.md,238.pdf,,,https://notebooklm.google.com/notebook/60c8513d-03ec-49ea-83a2-6fccf0e9d06e
239,Machine Learning,239.pdf,Vaccine Uptake Prediction Model,ML for Public Health Forecasting,Predicting Vaccination Rates,Public health policy making,Vaccine distribution planning,Epidemic control strategies,"A Machine Learning Classification Model (likely Random Forest) developed in Python using Pandas and Scikit-learn to predict vaccine adoption rates, aiding in public health policy making, vaccine distribution planning, and epidemic control strategies.",,,239,Data Science,Intermediate,Python,"Pandas, Scikit-learn",3 hours,"Machine Learning, Classification, Random Forest, Vaccine Prediction, Data Preprocessing",,,,,,239.jpg,239.mp4,239.md,239.pdf,,,https://notebooklm.google.com/notebook/1e7e0628-6fa7-4a9a-80ba-fab046fce6a0
240,Machine Learning,240.pdf,Multi-Modal Binary Classification on Emoticon Sequences,Predictive Emoticon Analysis,Binary Sequence Classifier,Sentiment analysis,Spam detection,Multimodal classification,"A machine learning project to predict binary outcomes using emoticon sequences, deep features	and text sequences.",,,240,"Machine Learning , Data Science",Intermediate,Python,"NumPy, Pandas, Scikit-learn, XGBoost, Matplotlib",5 hours,"Binary Classification, Feature Engineering, One-Hot Encoding, Subsequence Removal, Model Ensembling",,,,,,240.jpg,240.mp4,240.md,240.pdf,,,https://notebooklm.google.com/notebook/839eeba7-cdd0-4b8e-a6e7-e2a51fa4c29e
241,Software Development,241.pdf,Library Management System in C++,Digital Library Manager,C++ Book Tracking System,Managing library books and users,Track borrowing history,Calculating fines,"A console-based application where users can log in, borrow/return books	and librarians can manage the library.",,,241,Software Development,Intermediate,C++,"Standard C++ (iostream, fstream, vector, string, ctime, sstream)",10 hours,"Library Management, File I/O, Object-Oriented Programming, CSV Database",,,,,,241.jpg,241.mp4,241.md,241.pdf,,,
242,Data Analytics,242.pdf,Data Analytics for Mess Management,Food Wastage Reduction Analytics,Mess Consumption Predictor,Reduce food wastage,Optimize food preparation,Analyze consumption patterns,A Python script that analyzes daily food usage data to understand consumption patterns and reduce wastage.,,,242,Data Science,Beginner,Python,"NumPy, Matplotlib",2 hours,"data analysis, visualization, food wastage, mess management",,,,,,242.jpg,242.mp4,242.md,242.pdf,,,https://notebooklm.google.com/notebook/4f5412d5-123d-45c8-afb0-3f7f5e0f4100
243,Machine Learning,243.pdf,Vaccine Uptake Prediction Model,Vaccine Prediction Classifier,Health Behavior Predictor,Predict vaccine uptake,Plan vaccination campaigns,Assess health behaviors,A Python script that predicts the likelihood of vaccine uptake based on survey data.,,,243,Data Science,Intermediate,Python,"Pandas, Scikit-learn",3 hours,"Machine Learning, Classification, Random Forest, Vaccine Prediction, Data Preprocessing",,,,,,243.jpg,243.mp4,243.md,243.pdf,,https://gemini.google.com/app/9a7a04c9d18b8e76,https://notebooklm.google.com/notebook/6135bbc1-eda8-4ab3-a82a-d72bd5441c0e
244,Misc - Data Sci,244.pdf, Cosmic Radiation Research Dashboard ,Radiation Risk Calculator  ,Live Cosmic Ray Shower Map,Calculate radiation doses and cancer risks for space missions  ,Visualize real-time cosmic ray shower data on interactive maps  ,Explore biological effects of radiation exposure through interactive charts  ,"An interactive Streamlit dashboard for exploring cosmic ray data, calculating radiation risks, and visualizing impacts on space missions, biology, and electronics.",,,244,"Data Science , Astronomy",Intermediate,Python,"Streamlit, Pandas, NumPy, Matplotlib, Plotly, Folium, Seaborn, Requests",8 hours,"Cosmic Rays, Radiation, Space Weather, Data Visualization, Interactive Dashboard",,,,,,244.jpg,244.mp4,244.md,244.pdf,,,
245,Machine Learning,245.pdf,Maternal Pregnancy Risk Level Predictor,Pregnancy Risk Assessment,Maternal Health Classifier,Assess pregnancy risk,Provide early care to people with higher risk,Predict complications,A Python program that predicts pregnancy risk levels using maternal health data.,,,245,"Data Science, Healthcare",Intermediate,Python,"Pandas, NumPy, Matplotlib, Seaborn, Scikit-learn, TensorFlow",8 hours,"Machine Learning, Classification, Healthcare, Maternal Health, Risk Prediction",,,,,,245.jpg,245.mp4,245.md,245.pdf,,,https://notebooklm.google.com/notebook/6f745cb6-af4c-4438-bc2d-b18c15ec19f0
246,Software Development,246.pdf,Algorithmic Trading ,Algorithmic Trading in C++,Basic Algorithmic Trading ,Follow stock trends automatically,Make trading decisions automatically,Optimize portfolios,An implementation of algorithmic trading in C++,,,246,"Computer Science , Finance",Advanced,C++,"STL (vector, string)",10 hours,"Algorithmic Trading, Arbitrage, Order Book, Market Making, Statistical Arbitrage",,,,,,246.jpg,246.mp4,246.md,246.pdf,,https://gemini.google.com/app/96d450f88419fa25,https://notebooklm.google.com/notebook/f679a6bd-e88a-4ff7-86cb-4bf2de282a90
247,Machine Learning,247.pdf,Algorithmic Trading and Stock Price Prediction,Stock Price Forecaster,Trading Signal Generator,Stock prediction like keyboard autocomplete,Automate trading decisions,Predict stock prices,A CNN-LSTM model to predict Tata Motors stock prices for algorithmic trading.,,,247,"Data Science, Finance",Intermediate,Python,"TensorFlow, Pandas, NumPy, Matplotlib, Scikit-learn",8 hours,"Algorithmic Trading, Arbitrage, Order Book, Stock price prediction",,,,,,247.jpg,247.mp4,247.md,247.pdf,,https://gemini.google.com/app/a6de70896be789d2,https://notebooklm.google.com/notebook/f6a0a951-c856-4d28-a733-645fbe8193a3
248,Software Development,248.pdf,Automated C++ Code Grading Server,Code Submission Grader,Automated Code Evaluator,Automatically grade C++ submissions,Provide instant feedback after the assesment,Automate assessments,"A client-server system that compiles and runs C++ code, comparing output to expected results.",,,248,"Computer Science, Systems Programming",Intermediate,C,"Standard C libraries (socket.h, unistd.h, stdio.h, etc.), GCC compiler",8 hours,"Sockets, Client-Server, Autograding, Compilation, Process Execution, Load Testing",,,,,,248.jpg,248.mp4,248.md,248.pdf,,,https://notebooklm.google.com/notebook/eb06cedb-0650-48f5-afa9-7478a189dfe0
249,Deep Learning,249.pdf,Anisotropic MRI Super-Resolution Using Conditional GANs,MRI Image Enhancer,GAN-Based Super-Resolution,Enhance MRI resolution ,Improve medical imaging exeprience,Reduce MRI scan time,A SRGAN model to enhance low-resolution MRI images to high-resolution.,,,249,"Data Science , Computer Vision , Medical Imaging",Advanced,Python,"TensorFlow, Keras, NumPy, Matplotlib, scikit-image, nibabel, tqdm, scikit-learn",15 hours,"MRI, Super-resolution, GAN, SRGAN, Medical Imaging, Deep Learning",,,,,,249.jpg,249.mp4,249.md,249.pdf,,,https://notebooklm.google.com/notebook/14b477ef-8391-462f-bb88-e99af81bedd0
250,Machine Learning,250.pdf,Haze Removal Using Dark Channel Prior,Image Dehazing Tool,Atmospheric Light Corrector,Remove haze from images,Impove visibility of older pictures,Enhance photography experience,A MATLAB program that removes haze from images using dark channel prior.,,,250,"Computer Vision , Image Processing",Intermediate,MATLAB,Image Processing Toolbox,5 hours,"Haze removal, dark channel prior, image dehazing, atmospheric light, transmission map, guided filter",,,,,,250.jpg,250.mp4,250.md,250.pdf,,,https://notebooklm.google.com/notebook/6caade4d-3d8f-4da4-b1a5-9cb4dfc5de39
251,Software Development,251.pdf,Java to Assembly Compiler,Java Assembler,Cross-Language Compiler,Compile Java to assembly,Generate machine code from Java code,Learn about compiler design,A compiler that translates Java code to x86 assembly using Flex and Bison.,,,251,"Computer Science, Compiler Design",Advanced,C++,"Flex, Bison, GCC",10 hours,"Compiler, Java, Assembly, TAC, Symbol Table, AST, Lexical Analysis, Parsing",,,,,,251.jpg,251.mp4,251.md,251.pdf,,https://gemini.google.com/app/1a37562e48718fad,
252,Machine Learning,252.pdf,Age Group Classifier using Health Data,Health Age Predictor,Vital Signs Classifier,Insurance Risk Assessment,Personalized Diet Plans,Public Health Surveillance,An interactive ML tool that predicts age groups from health metrics to aid preventive care and resource planning,,,252,Data Science,Intermediate,Python,"Pandas, NumPy, Scikit-learn, Streamlit, Joblib",5 hours,"Machine Learning, Classification, Health Data, Streamlit, NHANES",,,,,,252.jpg,252.mp4,252.md,252.pdf,,,
253,Data Analytics,253.pdf,Statistical Analysis of River Discharge Data,Data-Driven Flood Prediction,MATLAB Data Modeling Suite,Predicting river overflow risks for urban planning,Analyzing seasonal discharge patterns for agriculture,Optimizing dam operations based on statistical models,"A comprehensive tool for civil engineers to analyze river data using probability and statistics, enabling better decision-making in water resource management.",,,253,"Data Science , Civil Engineering",Intermediate,MATLAB,MATLAB Statistics and Machine Learning Toolbox (for advanced stats functions),4 hours,"Discharge analysis, hypothesis testing, goodness of fit, confidence intervals, MATLAB, statistical distributions",,,,,,253.jpg,253.mp4,253.md,253.pdf,,,https://notebooklm.google.com/notebook/c2959000-86df-4a0a-a833-63b4111e9f6e
254,Machine Learning,254.pdf,Automated Attendance Robot Using Computer Vision,Vision-Based Presence Tracker,Attendance Automation using Raspberry Pi ,Monitoring classroom attendance for educational institutions,Tracking employee check-ins in office environments,Enhancing security with automated person detection,"An intelligent robot system that uses computer vision to detect and record attendance, improving efficiency and accuracy in various settings.",,,254,"Robotics , Computer Vision",Intermediate,Python,Debian OS (Raspberry Pi OS),8 hours,"Quadbot (Caterpillar treads, Metal Box Chassis)",,,,,,254.jpg,254.mp4,254.md,254.pdf,,,https://notebooklm.google.com/notebook/850d677c-3500-4cca-8414-79aad9ca4d3b
255,Machine Learning,255.pdf,Image Classification and Binary Classification,Neural Network Image Processor,Predictive Modeling Toolkit,Recognizing handwritten digits for banking applications,Classifying user behavior for targeted marketing,Detecting medical images for diagnostic assistance,"An educational platform teaching deep learning and traditional ML techniques, focusing on image recognition and binary decision-making tasks.",,,255,"Data Science , Machine Learning",Intermediate,Python,"TensorFlow, Keras, Scikit-learn, Pandas, NumPy, Matplotlib, Seaborn",6 hours,"CNN, MNIST, Logistic Regression, Feature Scaling, Data Preprocessing, Image Classification, Binary Classification",,,,,,255.jpg,255.mp4,255.md,255.pdf,,,https://notebooklm.google.com/notebook/e1e677ee-5c83-43d1-91cf-a7596b7023d6
256,Software Development,256.pdf,Flight Route Optimizer,Travel Path Minimizer,Airline Scheduling Assistant,Finding cheapest flight routes for budget travelers,Identifying fastest connections for business trips,Optimizing layovers for minimal travel time,"A graph-based algorithm system that computes optimal flight paths considering cost, time, and convenience factors for global travel planning.",,,256,Computer Science,Intermediate,Python,Python,10 hours,"Graph algorithms, BFS, Dijkstra, Priority Queue, Route optimization, Flight planning",,,,,,256.jpg,256.mp4,256.md,256.pdf,,,https://notebooklm.google.com/notebook/35045e5f-21c8-4fb5-a738-49a8a9811719
257,Data Analytics,257.pdf,Inventory Monitoring and Analytics Dashboard,Stock Level Analyzer,Sales Trend Visualizer,Preventing stockouts in retail stores,Forecasting demand for supply chain management,Analyzing product performance for pricing strategies,"A business intelligence dashboard that tracks inventory levels, sales data, and provides insights for efficient warehouse and retail operations.",,,257,"Data Science , Machine Learning",Intermediate,Python,"Pandas, NumPy, Librosa, Scikit-learn, Matplotlib, Seaborn, GloVe Embeddings",8 hours,"Emotion Recognition, Multimodal Learning, Audio Features, Text Embeddings, Machine Learning Classification",,,,,,257.jpg,257.mp4,257.md,257.pdf,,,https://notebooklm.google.com/notebook/e064ac2e-ace3-4d69-98b4-a95141ab67e6
258,Data Analytics,258.pdf,Econometric Analysis of the Odd-Even Policys Impact on Pollution Levels in Delhi,Policy Effect Evaluator,Environmental Impact Assessor,Measuring air quality improvements from traffic restrictions,Assessing economic costs of pollution reduction policies,Guiding urban planning for sustainable transportation,A statistical study using regression discontinuity design to quantify the effectiveness of Delhis odd-even vehicle policy on pollution reduction.,,,258,"Data Science , Econometrics",Intermediate,Stata,"Stata commands (regress, summarize, etc.)",8 hours,"Pollution, Odd-Even Policy, RDD, Regression, Delhi",,,,,,258.jpg,258.mp4,258.md,258.pdf,,,https://notebooklm.google.com/notebook/cab34f99-ef20-4912-bd73-968c57292f3b
